{
  "intent_id": "2026-06-03-001",
  "reviewer": "RIGHT",
  "decision": "APPROVE",
  "semantic_summary": "Plan matches request exactly. A single static HTML file is created in the fixture workspace. No runtime is touched, no service is started, no existing workspace app.py or templates are modified. The fixture scope is correct and self-contained.",
  "scope_status": "IN_SCOPE",
  "boundary_status": "CLEAN",
  "claim_hygiene": {
    "evidence_boundary": "UNCHANGED",
    "metaphor_literalization_risk": "LOW",
    "premature_canonization_risk": "NONE"
  },
  "human_confirmation": "NOT_REQUIRED",
  "must_not_touch": [
    ".workspace/app.py",
    ".workspace/templates/",
    "tests/",
    ".logs/sentinel.log",
    "services/"
  ],
  "notes": "This is a manual E2E trace for C-phase paperwork only. Sentinel execution gate is NOT activated. This review validates the pipeline shape, not live execution readiness. The staged file in .fixtures/manual_e2e/staged/ is the proof-of-plan, not a runtime artifact.",
  "one_line": "Fixture-only static file — scope clean, boundary clean, Sentinel stays sheathed."
}
